{
  "datasetVersion": "1.0.0",
  "caseId": "kn-07-photo-sharing-hld",
  "profile": "architecture",
  "levels": [
    {
      "level": 0,
      "name": "System",
      "frameKey": "pinhole.system",
      "title": "Pinhole in context",
      "availability": "available",
      "reveals": "Pinhole as one system, its two client apps and the two third-party systems outside its boundary.",
      "nodes": [
        "pinhole",
        "mobile-app",
        "web-app",
        "cdn",
        "push-provider"
      ],
      "edges": [
        "r.l0-mobile-pinhole",
        "r.l0-web-pinhole",
        "r.l0-pinhole-push",
        "r.l0-cdn-pinhole",
        "r.l0-mobile-cdn"
      ]
    },
    {
      "level": 1,
      "name": "Architecture",
      "frameKey": "pinhole.architecture",
      "title": "Pinhole containers",
      "availability": "available",
      "reveals": "The gateway, the three services, the workers, the queue and the three stores with labelled calls/reads/writes/publishes/subscribes edges.",
      "nodes": [
        "api-gateway",
        "auth-service",
        "upload-service",
        "feed-service",
        "media-workers",
        "message-queue",
        "object-storage",
        "metadata-db",
        "cache"
      ],
      "edges": [
        "r.l1-gateway-auth",
        "r.l1-gateway-upload",
        "r.l1-gateway-feed",
        "r.l1-upload-metadata",
        "r.l1-upload-queue",
        "r.l1-workers-subscribe",
        "r.l1-workers-objstore",
        "r.l1-workers-metadata",
        "r.l1-workers-publish",
        "r.l1-feed-subscribe",
        "r.l1-feed-metadata",
        "r.l1-feed-cache"
      ]
    },
    {
      "level": 2,
      "name": "Component",
      "frameKey": "pinhole.metadata-db",
      "title": "Metadata database: what it holds",
      "availability": "partial",
      "unavailableReason": "Only the metadata database has stated parts (its two record kinds, u22). No service has stated internals, so no other L2 frame exists.",
      "reveals": "The two record kinds the metadata database holds; nothing about schema.",
      "nodes": [
        "follow-relationships",
        "photo-records"
      ],
      "edges": []
    },
    {
      "level": 3,
      "name": "Flow",
      "frameKey": "pinhole.flows",
      "title": "Flows",
      "availability": "unavailable",
      "unavailableReason": "The source is HLD only (u3, u4): it gives no flows below service level, no operations and no code.",
      "reveals": "Nothing: the source stops at service level.",
      "nodes": [],
      "edges": []
    },
    {
      "level": 4,
      "name": "Operation",
      "frameKey": "pinhole.operations",
      "title": "Operations",
      "availability": "unavailable",
      "unavailableReason": "The source is HLD only (u3, u4): it gives no flows below service level, no operations and no code.",
      "reveals": "Nothing: no operations are described.",
      "nodes": [],
      "edges": []
    },
    {
      "level": 5,
      "name": "Source",
      "frameKey": "pinhole.source",
      "title": "Source",
      "availability": "unavailable",
      "unavailableReason": "The source is HLD only (u3, u4): it gives no flows below service level, no operations and no code.",
      "reveals": "Nothing: no code or paths are given.",
      "nodes": [],
      "edges": []
    }
  ],
  "nodes": [
    {
      "key": "pinhole",
      "label": "Pinhole",
      "match": {
        "all": [
          [
            "pinhole"
          ]
        ]
      },
      "kind": "backend",
      "level": 0,
      "expandsTo": "pinhole.architecture",
      "knowledge": [
        "ku.purpose",
        "ku.system-boundary"
      ],
      "evidence": [
        {
          "type": "source_unit",
          "unit": "u1",
          "availability": "available"
        },
        {
          "type": "source_unit",
          "unit": "u28",
          "availability": "available"
        }
      ],
      "uncertainty": {
        "note": "The canvas has no single 'Pinhole' shape: the system node stands for the internal frames together (Edge & API, Core services, Asynchronous processing, Storage).",
        "reviewRequired": true
      }
    },
    {
      "key": "mobile-app",
      "label": "Mobile app",
      "match": {
        "all": [
          [
            "mobile"
          ]
        ]
      },
      "kind": "frontend",
      "level": 0,
      "canvasElement": "e.mobile-app",
      "knowledge": [
        "ku.clients"
      ],
      "evidence": [
        {
          "type": "source_unit",
          "unit": "u5",
          "availability": "available"
        }
      ]
    },
    {
      "key": "web-app",
      "label": "Web app",
      "match": {
        "all": [
          [
            "web"
          ]
        ]
      },
      "kind": "frontend",
      "level": 0,
      "canvasElement": "e.web-app",
      "knowledge": [
        "ku.clients"
      ],
      "evidence": [
        {
          "type": "source_unit",
          "unit": "u5",
          "availability": "available"
        }
      ]
    },
    {
      "key": "cdn",
      "label": "CDN",
      "match": {
        "all": [
          [
            "cdn",
            "content delivery"
          ]
        ]
      },
      "kind": "external",
      "level": 0,
      "canvasElement": "e.cdn",
      "knowledge": [
        "ku.cdn",
        "ku.system-boundary"
      ],
      "evidence": [
        {
          "type": "source_unit",
          "unit": "u25",
          "availability": "available"
        },
        {
          "type": "source_unit",
          "unit": "u26",
          "availability": "available"
        }
      ]
    },
    {
      "key": "push-provider",
      "label": "Push-notification provider",
      "match": {
        "all": [
          [
            "push"
          ]
        ]
      },
      "kind": "external",
      "level": 0,
      "canvasElement": "e.push",
      "knowledge": [
        "ku.push-provider",
        "ku.system-boundary"
      ],
      "evidence": [
        {
          "type": "source_unit",
          "unit": "u25",
          "availability": "available"
        },
        {
          "type": "source_unit",
          "unit": "u27",
          "availability": "available"
        }
      ]
    },
    {
      "key": "api-gateway",
      "label": "API gateway",
      "match": {
        "all": [
          [
            "gateway"
          ]
        ]
      },
      "kind": "backend",
      "level": 1,
      "parent": "pinhole",
      "canvasElement": "e.api-gateway",
      "knowledge": [
        "ku.gateway",
        "ku.gateway-fails-closed"
      ],
      "evidence": [
        {
          "type": "source_unit",
          "unit": "u8",
          "availability": "available"
        },
        {
          "type": "source_unit",
          "unit": "u9",
          "availability": "available"
        },
        {
          "type": "source_unit",
          "unit": "u10",
          "availability": "available"
        },
        {
          "type": "none",
          "availability": "unavailable",
          "note": "The source is HLD only and names no file or code (u4)."
        }
      ]
    },
    {
      "key": "auth-service",
      "label": "Auth service",
      "match": {
        "all": [
          [
            "auth"
          ]
        ]
      },
      "kind": "backend",
      "level": 1,
      "parent": "pinhole",
      "canvasElement": "e.auth",
      "knowledge": [
        "ku.auth"
      ],
      "evidence": [
        {
          "type": "source_unit",
          "unit": "u12",
          "availability": "available"
        },
        {
          "type": "none",
          "availability": "unavailable",
          "note": "The source is HLD only and names no file or code (u4)."
        }
      ]
    },
    {
      "key": "upload-service",
      "label": "Upload service",
      "match": {
        "all": [
          [
            "upload"
          ]
        ]
      },
      "kind": "backend",
      "level": 1,
      "parent": "pinhole",
      "canvasElement": "e.upload",
      "knowledge": [
        "ku.upload-service"
      ],
      "evidence": [
        {
          "type": "source_unit",
          "unit": "u13",
          "availability": "available"
        },
        {
          "type": "none",
          "availability": "unavailable",
          "note": "The source is HLD only and names no file or code (u4)."
        }
      ]
    },
    {
      "key": "feed-service",
      "label": "Feed service",
      "match": {
        "all": [
          [
            "feed service",
            "feed"
          ]
        ]
      },
      "kind": "backend",
      "level": 1,
      "parent": "pinhole",
      "canvasElement": "e.feed",
      "knowledge": [
        "ku.feed-service",
        "ku.photo-ready-fanout"
      ],
      "evidence": [
        {
          "type": "source_unit",
          "unit": "u14",
          "availability": "available"
        },
        {
          "type": "source_unit",
          "unit": "u18",
          "availability": "available"
        },
        {
          "type": "none",
          "availability": "unavailable",
          "note": "The source is HLD only and names no file or code (u4)."
        }
      ]
    },
    {
      "key": "media-workers",
      "label": "Media processing workers",
      "match": {
        "all": [
          [
            "worker",
            "media processing"
          ]
        ]
      },
      "kind": "backend",
      "level": 1,
      "parent": "pinhole",
      "canvasElement": "e.workers",
      "knowledge": [
        "ku.workers",
        "ku.stuck-photos"
      ],
      "evidence": [
        {
          "type": "source_unit",
          "unit": "u15",
          "availability": "available"
        },
        {
          "type": "source_unit",
          "unit": "u16",
          "availability": "available"
        },
        {
          "type": "source_unit",
          "unit": "u17",